{
	"_comment": "Schema example for /api/validator.json. The real file is generated at runtime by scripts/node-info.sh against a live metalgo mainnet node and is gitignored. This example documents the expected shape and field types; values shown here are placeholders.",
	"schema_version": 1,
	"phase": 2,
	"mode": "mainnet",
	"network": "metal-mainnet",
	"nodeId": "NodeID-XXXXXXXXXXXXXXXXXXXXXXXXXXXXXXXXX",
	"bootstrap": {
		"pChain": true,
		"xChain": true,
		"cChain": true
	},
	"stake": {
		"self": null,
		"totalReceived": null,
		"unit": "METAL",
		"_note": "self = operator self-stake. totalReceived = total delegated stake. max_weight = 5 × self (protocol rule)."
	},
	"uptime": {
		"network": null,
		"self": null,
		"source": "self-reported",
		"sampleSize": 0,
		"samples": [],
		"_note": "network = median uptime as observed by external RPCs (peer-observed truth). self = the node's own response (always ~100% by protocol; reference only). source = 'external-median' when network is peer-observed; 'self-reported' when external RPC unavailable and self value is the fallback. Reward threshold: 80%."
	},
	"delegationFee": {
		"percent": null,
		"_note": "Protocol minimum 2%; the operator's chosen rate may be higher."
	},
	"explorer": "https://explorer.metalblockchain.org/",
	"observedAt": "1970-01-01T00:00:00Z"
}
